Name,Description,Average Score,Number of Reviews
Lands of Adventure,"From the back of the box:

A fantasy role playing adventure game for use by a Gamemaster and any number of players (ages 12 and up). LANDS OF ADVENTURE includes all rules necessary for the creation of characters, encounters, combat, magic, and adventure. It is a unique game in that it has been designed for adaptability of world background.

Modular 'Culture Packs' detail the necessary changes and additions to the basic system to add on new 'worlds' from myth and legend. Each such world background is carefully researched and presents an in depth survey of the culture, religion, and social framework of the society portrayed.

This package comes complete with the basic rules to LANDS OF ADVENTURE and a double culture pack detailing the epic worlds of Mythic Greece and Medieval England (with an additional section on the England of King Arthur). Thus, even the basic game is playable in a world of the Gamemaster's creation or in either of the two cultural backgrounds provided.",6.5,5
The Last Exodus,"User Summary:
Subtitled &quot;The Interactive Story Arc of the Third and Last Dance,&quot; The Last Exodus is a game of modern day demigods struggling to save, or damn, the perfect world.

From the back cover:
&quot;In 1981, the second coming of Christ was born a Muslim girl in Medugorje, Yugoslavia.

In 1995, she was executed during the ethnic cleansing of a small Croatian town.

In 1999, the priests and prophets began the search to find her brothers and sisters before it was too late.

This is where you come in.

Who will you save?&quot;",6,1
The Laundry,"Publisher blurb:

CAPITAL LAUNDRY SERVICES - WHAT NEEDS TO BE CLEANED UP?

There are things out there, in the weirder reaches of space-time where reality is an optional extra. Horrible things, usually with tentacles. Al-Hazred glimpsed them, John Dee summoned them, HP Lovecraft wrote about them, and Alan Turing mapped the paths from our universe to theirs. The right calculation can call up entities from other, older universes, or invoke their powers. Invisibility? Easy! Animating the dead? Trivial! Binding lesser demons to your will? Easily doable!

Opening up the way for the Great Old Ones to come through and eat our brains? Unfortunately, much too easy.

That's where the Laundry comes in - it's a branch of the British secret service, tasked to prevent hideous alien gods from wiping out all life on Earth (and more particularly, the UK). You work for the Laundry. The hours are long, the pay is sub-par, the co-workers are... interesting (in the Chinese curse sense of the word), and the bureaucracy is stifling - but you do get to wave basilisk guns and bullet wards around, and to go on challenging and exciting missions to exotic locations like quaint, legend-haunted Wigan, cursed Slough and Wolverhampton where the walls are thin.

You may even get to save the world.

Just make sure you get a receipt.

THE LAUNDRY roleplaying game is based on the award-winning Laundry series (THE ATROCITY ARCHIVES, THE JENNIFER MORGUE, THE FULLER MEMORANDUM) by the even-more-award-winning CHARLES STROSS, and uses the also-award-winning BASIC ROLEPLAYING SYSTEM (CALL OF CTHULHU).

In this book, you'll find:


    Computational demonology, summoning extradimensional horrors, and three ways to use a shotgun to banish alien monsters.
    A history of the Laundry and the other occult intelligence agencies
    Classified briefings on known threats and monstrous horrors
    Streamlined rules for character creation, investigation and combat
    Three ready-to-play missions",7.82432,37
Legacy,"From the back of the book:

For over a decade, Role-Players have come to the Emerald Empire of Rokugan to learn the true meaning of honor and glory. Now it is your turn to take up your katana in the name of your clan.

The Minor Daimyo Doji Haruki has always craved more power and prestige among those who possess true influence in the Imperial Court. Now, on the eve of his greatest and most promising court, mere hours before his moment truly arrives, his most valued treasure is stolen. The daisho of Seppun Daiori, gifted to Haruki by the Seppun family, is mysteriously absent. Fearful that his greatest triumph shall become the the moment of his ruination, Haruki turns to a handful of samurai who arrived for court ahead of schedule, desperate for their aid in returning the daisho before the court concludes.

This adventure was given away as part of Free RPG Day 2010.",6.55556,18
Legend of the Five Rings Role-Playing Game,,,
Legends of Anglerre,"Publisher's blurb:

Legends of Anglerre shoves a massive battle axe in the hands of the Ennie Award nominated Starblazer Adventures roleplaying game. This stand-alone fantasy interpretation of the popular Fate 3.0 rules features two detailed settings:


     Anglerre, the world featured in the original Starblazer fantasy comics, and
     Lords of the Hither Kingdoms, a brand new setting.


Artwork from the Starblazer comics brings the worlds to life and will inspire Story Tellers to get plotting!

Players will be able to start with gritty characters through to epic demi-god like heroes, lead armies, fleets and kingdoms, conduct sieges and build a dynasty. New FATE rules include an elegantly simple system for magic and creature powers, personal campaign goals, epic style abilities, combo manoeuvres, magic artefacts and summoning as well as a detailed character background generator. Two introductory adventures, a fantasy campaign generator and fantasy bestiary will help new players jump straight in to the action!

Imagine your patrol ship strafing a fleet of galleys defended by dragons and sorcerors! Legends of Anglerre is fully compatible with the Starblazer Adventures core book, allowing space opera characters to be dropped into a fantasy campaign.",7.41667,36
Legionnaire,"From the back of the bookIn 6831, the battlefield is a place of pushbutton death and searing destruction where human courage is every bit as important as the technology. But not all battles are won on the field, and not all combat is as straightforward as a tank commander would like. Espionage, sabotage, and intrigue await players of the Renegade Legion: Legionnaire!

Renegade Legion: Legionnaire provides all the information needed to create and play a character in this ominous setting. Be a starfighter pilot, an anti-gravity tank commander, or just a free-booting adventurer in Renegade Legion: Legionnaire.

Renegade Legion: Legionnaire includes material on character generation, career packages, skills, attribute points, experience, rank, and fame. There are rules given for characters of alien races found within the Terran Overlord Government (TOG), the Commonwealth, and the, Renegade Legions. Equipment and weapons are listed, along with individual combat rules. TOG and Commonwealth histories are presented. Shannedam County is spotlighted with planetary maps and strategic details. Here is everything you need to join the fight.

In the battle between good and evil, this one counts!",6.39286,14
Lejendary Adventure,"From the back cover:

&quot;Lejendary Adventure is a game apart; Where wizards can wield swords and fighters learn spells. With a rules-light approach this skill-based game allows you to create virtually any sort of epic character desired.

Lejendary Adventure moves beyond the class system of typical RPGs: Character creation is easy and centered around skill bundles chosen at the start of play and earned while on the road to adventure. These abilities allow you to customize your character, all the while plundering the wealth of lost dungeons, or wandering far afield on the road of glory and adventure.

With your imagination you can create a limitless world filled with powerful knights, wizards, and creatures of legend.

Essentials is designed as an expanded introduction to the Lejendary Adventure role playing game. It includes Essentials: The Lejendary Adventure rule book, the Essential Bestiary with over 75 monsters, Moon Slaves, an introductory adventure and Six Playing Dice. Everything you need to launch a lifetime's night of fun.&quot;",7.2,5
Leverage: The Roleplaying Game,"Publisher Blurb:

The rich and powerful, they take what they want. You steal it back. You were bad guys, but there are worse people out there. The weak and the helpless need you. You provide... leverage.

The Leverage Role Playing Game puts you in the middle of a dysfunctional but highly-specialized group of con-artists, criminals, and crooks who are trying to turn over a new leaf. You protect the victims of corporations, mobsters, and corrupt politicians by using your expert skills to outwit and overcome the real bad guys. Using the award-winning Cortex System as its foundation, the Leverage RPG includes all the rules you need to create a team of rogues, plan a job, and get it done... even if it means going to Plan B.",7.25,20
Leystorm: The Dominion,,,
Liminal Horror,"From the itch.io page:

Liminal Horror is a rules-lite, fail forward system that leverages creative problem solving in order to create memorable experiences at the table. Players act as investigators navigating a modern world full of terrible and unknowable things that hide in the spaces between, looking for a way in.

For fans of Junji Ito, horror, Call of Cthulhu, Monster of the Week, Silent Legions but wanting rules-lite adaptable system. It is a modern horror hack of Yochai Gal's Cairn (Into the Odd + Knave).

Gameplay: Fast and simple rules (the summary fits onto a single page). There are 3 stats (Strength, Dexterity, Control) and players makes saves when there is a risk of failure. Rolling equal to or under is a success. There are not rolls to hit (damage is dealt automatically).

Stress &amp; Fallout: Play deals with horror themes. This is represented mechanically by Stress and Fallout. Fallout is how characters are changed by the Old Powers. The design avoids using mental illness and trauma as game-play mechanics.

Magic: Magic is dangerous, random, and chaotic. Liminal Horror adapts the Maze Rats magic system (thanks to the work of Xenio).",7.16667,3
Little Fears,"Little Fears is a stand-alone roleplaying game where the players take the role of children, fighting against the monstrous Seven Kings of Closetland, from the Bogeyman to Baba Yaga to The Defiler. The Seven Kings are after the Innocence of the world's children...

Frome the back cover:

Remember when you were young and you were afraid of all those things that went bump in the night?

Ever wonder where they went?",7,19
Living Steel,"From the introduction to the 1988 2nd-edition hardcover:

Living Steel&trade; is a complete high-tech role-playing system. Included are all the rules necessary for play, as well as guidelines for the game's setting, the world of Rhand.

The action begins in the year 2349; the players find themselves in the middle of Humanity's Apocalypse, and are faced with the twin tasks of surviving and rebuilding civilization. Working against them are vast numbers of brigands, madmen, and hostile aliens, and the fact that technology is breaking down rapidly. The players have talent and experience on their side, however as well as a few of the sophisticated Power Armor suits for which the game is named; Living Steel. From that starting point, the players determine their own futures.


User summary:

Science-fiction/post-apocalyptic role-playing game set on the planet Rhand (not quite the same version as seen in Rhand: Morningstar Missions). The 1987 first edition is compatible with the Phoenix Command combat system; the 1988 second edition is compatible with the Dragonstar Rising boardgame.",6.54762,21
Lone Wolf,"From the back cover:

GET READY FOR THE GREATEST ADVENTURE OF YOUR LIFE!

&ldquo;You race through the tangled forest, chased by a mob of vicious Giaks. Somewhere in the distance a pack of Doomwolves howls. Up ahead you can hear the roar of the waterfall, cutting off your path.

What do you do next?&rdquo;

In The Lone Wolf Adventure Game you decide!

In The Lone Wolf Adventure Game you are Kai Lords &ndash; brave and noble warrior-monks sworn to protect the realm of Sommerlund from the evil of the Darklords &ndash; adventuring across the world of Magnamund. You and your friends will face terrifying enemies and uncover fiendish plots, working together to overcome the wicked plans of the Darklords and emerge victorious!

Joe Dever&rsquo;s Lone Wolf gamebooks introduced a whole generation to fantasy gaming &ndash; now the legend continues with The Lone Wolf Adventure Game. Epic quests, thrilling combat, and a world of dangerous adventure lie ahead!

This boxed set contains everything you need to play right away:


     Read This First guide
     6 adventure-ready Kai Lords 
     Book of Kai Legends
     Book of Kai Training
     Book of Kai Wisdom
     Tokens and counters
     Handouts and reference sheets
     Map of Sommerlund",7.52187,16
Lord of the Rings Adventure Game,"&quot;Lord of the Rings Adventure Gaming (LOR) is a role-playing game based on the writings of J.R.R. Tolkien (specifically The Lord of the Rings and The Hobbit) under license from Tolkien Enterprises. Iron Crown Enterprises (I.C.E.) published the game until they lost the license on 22 Sep 1999.

From the back of the Box:

In the &quot;Lord of the Rings Adventure Game&quot; you'll follow in the footsteps of all the great heroes of legend. As a mighty Elven Warrior or a deft Hobbit Scout, you'll enjoy hours of adventure in the magical, mythical world of J.R.R. Tolkien.

Inside this Box:
- a Complete Adventure
- Rules
- Color Map
- Adventure Map 
- Floorplans
- Characters
- Playing Pieces
- Dice&quot;

Source: Wikipedia, &quot;Lord_of_the_Rings_Adventure_Game,&quot; available under the CC-BY-SA License.",7.45,20
The Lord of the Rings Roleplaying Game,"User Summary:

An introductory boxed RPG and adventure set based on the fellowships travels through Moria. Players can take on the pregenerated roles of any of the nine members of the fellowship and be guided through an adventure by the Narrator.

Contents:
--&quot;What is Roleplaying&quot;/&quot;What's in this Box?&quot; (2 pages)
--&quot;Fast Play Rules&quot; (4 pages)
--&quot;Through the Mines of Moria&quot; adventure guide
--&quot;Welcome to Middle Earth&quot; broad overview of the world
--Cardboard counters
--9 pregenerated characters
--Two mapsheets containing a number of maps

If the players are interested in creating their own characters and adventurers, the manual recommends they seek out Decipher's Lord of the Rings RPG.",6.95455,11
Lords of Creation,"From the box:

&quot;The ultimate role-playing game... a game of science, fantasy, science fiction and high adventure that explores the farthest reaches of your imagination! Splendid adventures take place throughout time, space and other dimensions.

&quot;Designed for both experienced role-playing gamers and beginners, LORDS OF CREATION allows unlimited voyages via your imagination through time and beyond worldly dimensions. Journey into magical realms ruled by swords and sorcery... battle bizarre aliens and killer robots on mysterious planets in distant galaxies... venture into the worlds of mystery, horror and wonder hidden just beneath the surface of the present everyday world. Experience thrilling adventures as you become a valiant and courageous hero! All you need to play are the rules and dice included... and your imagination!&quot;

The box game includes a 64-page Rule Book, a 64-page Book of Foes, and three dice (d6, d10 and d20).As implied by the box text, the game is designed as an all-encompassing roleplaying system that includes fantasy, modern and science-fiction skills, powers, and weaponry, including vehicle rules. The sample settings at the back of the book include the Nine Worlds (based on Norse myth), Paris in the Swashbuckling Era, and Priddo (parallel universe).

Heroes magazine from The Avalon Hill Game Company includes variants and the Survival Run of the Starnomads adventure (Heroes Vol 1.1)",6.30769,26
Ma Nishtana,"Ma Nishtana: Why is this Night Different? is a story game created by Gabrielle Rabinowitz and Ben Bisogno with art by Katrin Dirim, modeled on a Passover Seder&mdash;specifically the one we share in our family. The seder is a ritual meal and collaborative re-telling of the Jewish Exodus from Egypt. In Ma Nishtana, there are opportunities to eat all of the ritual foods or perform more abstract (and remote play-friendly) rituals.

Together, we breathe new life into the Exodus story by embodying our own versions of key characters and navigating the emotional ties between them. We take turns guiding a series of role-played scenes called &ldquo;Rituals&rdquo;, which culminate in the deliverance of the Hebrew people from peril. Our choices will directly shape the trajectory of our story.

At its core, Ma Nishtana is a storytelling circle that invites us to explore a world filled with wonder, terror, and deep care. Through the eyes of our characters we discover what the story of Passover has to teach us: the weight of sacrifice, the strength of community, and the responsibility we have to those who seek a place to call home.

Source: The Game Website.",0,0
Mach: The First Colony,"User summary:

Mach's tagline is &quot;A role playing game of soldiers of fortune in a New World.&quot; It's a self-contained sci-fi RPG with a unique premise: Aliens called the Abla come to Earth in the late 20th century, inform humanity of an impending catastrophe, and transport the entire human race to the colony world of Mach.

The box set contains three black-and-white 32-page booklets. Books I and II (they are otherwise untitled) contain the rules for the game; there's no clear reason as to why some rules are in one book as opposed to the other. The third, III, is an adventure entitled &quot;Frontier Series #1: Guilden's Farm.&quot;

Mach uses traditional polyhedral dice, mainly percentile, and has a &quot;sandbox&quot; feel to it. The group is encouraged to decide what their version of Mach is like, develop the starting region, etc.",3,1
Macho Women with Guns,"From the back of the book:

Yes, it's true!  Macho Women with Guns is back!  The only roleplaying game in the Vatican Archives is now in it's second edition!  All the bad things rolled into one tasteless volume, with scads of new rules, lots of cool artwork and literally thousands and thousands of words arranged into marginally coherent sentences!

We know what you want*, and once again we shamelessly pander to your basest instincts in an effort to get our hands into your pockets and...well...never mind.  Anyway, if you are tired of storytelling and diceless angst, and just want to go out and blow the living daylights out of something, Macho Women is the only way to go!",6.13636,11
Macross II: The Role-Playing Game,"From the introduction:

This is the fifth sourcebook for Macross 2050. It contains information for the Mardook Army as presented originally by Palladium Books, as well as information to use the Mardook in the Macross canon storyline. This book is purely optional for a Macross 2050 campaign, and the GM is neither required nor encouraged to use it.",0,0
Maelstrom,"Enter the world of Maelstrom - the fabulous new role-playng game!

Imagine a band of travellers on the long road from St Albans to London - a dangerous journey in troubled times. Which will YOU be?

A herbalist, a rogue, a noble lady, a spy - or any one of a host of different characters.

YOU choose the characters, YOU decide the missions and YOU have the adventures in the turbulent world of Europe in the 16th century - either as a player or as the referee.

Complete with Beginners&rsquo; and Advanced Rules, Referee&rsquo;s Notes, maps, charts and a solo adventure to get you started, Maelstrom is a great game for three or more players.",7.11111,18
Mage: The Ascension,"From the back cover:

An Epic Game of Reality on the Brink

Magick is not dead.
Open your eyes and see with mystick sight.
A War rages,
A Reckoning is at hand.
On one side stand the Others,
Who would twist our world with their mad designs;
On the other hand, the snare of Pride,
And Power's lure,
Await an inner Fall.
Is our Path too narrow?
You decide.
Come forth,
A journey beckons,
Open your eyes
And Awaken.",7.40435,115
Mage: The Awakening,"The Power to Remake the World
In an age long gone, mortals dethroned the gods and seized the heavens for their own. And for it, they were flung down into the world of clay, their minds clouded by ignorance. Only a bare few remember their birthright - the power of magic. If they cannot claim the heavens, they will make their own kingdoms on Earth.

A Storytelling Game of Modern Sorcery
- Provides everything you need to tell your own stories in the occult world of the Awakened, including details of the various orders and paths of magic, and many secrets of the World of Darkness. Requires the World of Darkness rulebook for play.
- Presents the most comprehensive and freeform magic system ever achieved in gaming, allowing characters to cast nearly any spell imaginable.
- Features Boston as a fully fleshed-out, ready-to-play setting.
- Features artwork by the acclaimed Michael Kaluta.",7.01013,79
Mage: The Sorcerer's Crusade,,,
Malefices,"The game is set during the pre-WWI part of the French Third Republic (1870-1914), at a time where superstition, legends and witchcraft of countryside is confronting reason, science and industry of cities. Mystery and supernatural are what the players must expect.

A box with one 56 pages rule book containing a description of France and the rest of the world in 1870-1914, a booklet with 2 scenarios, a screen, character sheets, 2 d10 and a deck of 20 tarot card. The special tarot cards are used for the character generation.",9.33333,3
"Man, Myth & Magic","&quot;A role playing game of man's greatest adventures.&quot;

User summary and back of box:

Start off as a Roman Gladiator and reincarnate as ... &quot;an Egyptian Sorcerer, a British Druid, even, perhaps an Irish Leprechaun to face the might and the mysteries of the ancient world!&quot;

Boxed set contains three books:

Book I: The Basic Rules (24 pages)
Book II: The Advanced Rules (40 pages)
Book III The Adventures Book (52 pages)
plus a pad of character sheets and several perforated maps and charts

The latter book contained the first four episodes of a continuing adventure that was ultimately fleshed out to nine by additional adventure modules, all of which required the advanced rules.",4.92308,13
Manhunter,"subtitle: A Game of Bounty Hunting in the Far Future

From the back cover:

&quot;In the High Tech World of Manhunter, Excitement is Just Around the Corner ... or the next Star!

     Complete Rules for a Futuristic Bounty Hunting RPG
     Includes everything From High Tech to Magick
     Choose from Terran, Alien or Even Robotic Characters
     Special Ship Design and Robotic Design Rules
     Detailed List of the Most Wanted Criminals&quot;",6.5,4
Marvel Heroic Roleplaying,"From the back of the book:

				
				
					IT&rsquo;S TIME TO STEP UPThe Avengers have been disassembled, the Fantastic Four are somewhere in space, and the X-Men aren&rsquo;t answering their phone. When dozens of dangerous villains are sprung from the maximum-maximum security prison known as the Raft, who&rsquo;s going to stop them? You are.

				
				
					ALL THE RULES, ALL THE ACTIONExperience all of the pulse-pounding action and nail-biting drama of the Marvel Universe at your gaming table. It&rsquo;s one thing to stop an alien invasion or throw down with the Juggernaut, but sometimes you&rsquo;ve got to make the hard choices&mdash;will you let a dangerous villain escape in order to save an innocent life?. With the MARVEL HEROIC ROLEPLAYING Basic Game, that great power and great responsibility is yours.

This Rulebook Includes:

     Operations Manual: Easy to learn game rules for playing characters from the Marvel Universe and playing out your favorite Marvel Blockbuster Events!
     Breakout: Based on the acclaimed story arc from Brian Michael Bendis&rsquo; New Avengers, including a super villain prison break and a perilous journey to the Savage Land!
     Hero Datafiles: Game play sheets for many of your favorite Marvel Super Heroes, from Captain America and Spider-Man to the X-Men and Fantastic Four!


For two to eight players, ages 13 and up. Requires game dice.",7.57863,131
Marvel Super Heroes Adventure Game,"The core box set, containing the basic rules and advanced options, a narrator's guide, a catalog of powers, a roster of heroes and villains and the &quot;Might Marvel Fate Deck&quot;.",7.30889,45
Marvel Super Heroes Role-Playing Game,Marvel Super Heroes was licensed by Marvel Universe to TSR in 1984.,7.0848,102
Marvel Universe Roleplaying Game,"Spider-Man, The X-Men, Daredevil, The Hulk, and the rest of the Marvel Universe come to life in this revolutionary new roleplaying game from Marvel Comics.

Easier and more accessible than any RPG before, the Marvel Universe Roleplaying Game lets you play more than 40 of your favorite  super heroes and super villains or create new heroes and villains of your own.

This guide contains everything you need to learn and play, including full game system rules, character profiles, briefings and background for the Marvel Universe, pull-out Character Action Display, and a beginning adventure complete with maps.",6.0641,39
