Name,Description,Average Score,Number of Reviews
13th Age,"From the back cover:

The World Won't Save Itself

Prophecies fail. Demons invade, living dungeons rip towards the surface, and the Empire's protectors falter. The great icons who shape the world arm for war.

So what's it going to be, heroes? Risk everything to forge your own epic history? Or grab the best loot and escape into the shadows?

13th Age is a d20-rolling fantasy game of battle, treasure, group storytelling, and heroic adventure.

For Players:

     Your character's &quot;one unique thing&quot; ensures there's no one else like you.
     Alliances and enmities with icons such as the Archmage, Lich King, and Prince of Shadows give your character a place in the world's story, even at first level.
     Streamlined and flexible combat rules create fast-moving, free flowing battles.
     Character backgrounds let you invent the stories that shape your skills.


As a GM:

     Design monsters and adventures quickly.
     Surprise yourself and your players with plot hooks from characters' backgrounds and unique features.
     Improve any d20-rolling game with mechanics such as the escalation die and incremental advance.


13th Age: Forge heroes. Shape the world. Be legendary.",7.90114,131
The 23rd Letter,"From the publisher:

The time is now.

Psychics exist, not many, but enough - enough to worry those in power, and interest those who seek power. Governments and Corporations fight over them. The Network provides an imperfect refuge for those that escape the clutches of those who would abuse them or their powers.Thousands are maimed and killed each year by the Corporations and Governments. Some do this for power, some for defence, but they all do it, - for the next war will be fought with the mind - and the victor will control the destiny of the human race.",0,0
2300 AD,2300AD is a hard science-fiction role-playing game set in the early years of the 24th century. It is a revised renamed second edition of Traveller: 2300.,7.28917,60
3D&T,"from the manual:
Este guia n&atilde;o inclui orienta&ccedil;&otilde;es para mestres, vantagens &uacute;nicas, e grande parte das vantagens, desvantagens e regras de combate avan&ccedil;adas. O motivo &eacute; simples: seu objetivo &eacute; salvar mestres experientes em situa&ccedil;&otilde;es desastrosas (como quando, por exemplo, em uma nova mesa muitos jogadores iniciantes enrolam com o grande livro de regras por horas, ou mesmo quando aquele seu &ldquo;amigo&rdquo;, sem avisar, aparece para fazer uma visita e resolve entrar na mesa de RPG e voc&ecirc; precisa que ele fa&ccedil;a sua ficha r&aacute;pido, e sem fazer muitas perguntas) e ajudar a introduzir jogadores iniciantes nos conceitos de 3D&amp;T.

[english translation]
This guide does not include guidelines for game masters, unique benefits, a large part of the advantages, disadvantages or advanced combat rules. The reason is simple: the goal is to save experienced game masters in disastrous situations (such as when, for example, in a new game many beginning players curl up with the main rule book for hours, or her &quot;friend&quot;, visits unannounced and decides to play and you need to set them up quickly, without too many questions) and help to introduce players beginners in the concepts of 3D&amp;T.",7,1
7th Sea,"The first of two core rulebooks for the 7th Sea roleplaying game.

The Player's Guide includes a description of the basic mechanics of the game, rules for character creation, and an overview of the nations and secret societies that inhabit the setting.

Back of the Book:

Swashbuckling and Sorcery
Piracy and Exploration
Espionage and Intrigue
Welcome to the New World

7th Sea is a game of action and high adventure in a world of musketeers, pirates, secret societies and political intrigue. Players take the roles of heroes bent o&shy;n thwarting the plots of knaves and villains, exploring ancient ruins and plundering the treasure fleets of tyrants. Everything a player needs is included in the pages of this book.


     Easy to get started: The book opens with a Quick Start Guide so you can start playing within minutes. 
     A Complete New World: Players will find almost o&shy;ne hundred pages devoted to Theah, the world of 7th Sea. 
     Flexible rules: 7th Sea uses a unique bidding system, giving players and Game Masters control over the mechanics of the game. 
     Advice for Novice and Experienced Players: If you've never played a roleplaying game before, or if you're an &quot;old school&quot; veteran, you'll find tons of hints and advice to help you act and interact within the world of 7th Sea.


The Indispensible guide for players of the 7th Sea Roleplaying game.",7.57759,116
Aberrant,"Your Legacy Is Our Future

Golden age or Hell on Earth? To the residents of the Trinity Universe, the 21st century was a monstrous era when mad gods ran rampant across the world. But is this truth or OpNet propaganda? What was the Age of Aberrants really like? Find out the truth. Its not what you expect.
Age of Hope, Age of Sacrifice

Aberrant is a core rulebook and prequel to the Trinity science-fiction game that deals with the Aberrant Era. Set in the early 21st century, before the devastating war against humanity, this new complete roleplaying game allows you to be one of these doomed beings of vast power, and to experience their struggles to avoid the coming cataclysm.",6.96875,72
ACE Agents!,"From the back of the book:

A.C.E. Agents! is an adventure game set in a universe of spies, counterspies, running battles, high technology, and intrigue. As an A.C.E. Agent, you'll battle P.Y.T.H.O.N., a group of evil criminals out to dominate the world. The only things standing between P.Y.T.H.O.N. and world domination are you, your fellow A.C.E. Agents, and the fact that the Elite Council of P.Y.T.H.O.N. can't decide what the acronym of their name stands for. So buy this game, join A.C.E. and save the world!",6,1
Active Exploits,"This is the free downloadable edition of Active Exploits - Version 1.1, according to the title page.

FEATURES:

* Basic, Advanced, and Live Action (LARP) Rules
    * Custom rules and information for the Arcane (magic and the occult) and Martial Arts
    * Plus, director's notes, and more.",5.85,10
Editions of Dungeons & Dragons,"The first boxed set in the Complete Dungeon Master series. Designed for use with any fantasy roleplaying system, rules are included for D&amp;D, AD&amp;D and Runequest.

Contents from back of box:

Fully detailed 24-page scenario
10 scenic illustrations on artboard
3-piece dungeon master's screen
12 sheets (A4) of floor plans
4 full pages of maps, scrolls, etc.
4 large cards of NPC statistics

This adventure was later reworked for Warhammer Fantasy Roleplay and published under the name 'Dwarf Wars'.",6.66667,3
Advanced Fighting Fantasy,"From the publisher's website:

The huge success of the Fighting Fantasy gamebooks spawned, in 1989, a full-blown Roleplaying game based upon the same fantasy world. Originally published as three separate books, this classic game has now been revised, re-written and re-released for a new generation of gamers. Revised rules, brand new material and original illustrations combine to make this a classic RPG for the modern age.

The new version of Advanced Fighting Fantasy is perfect for original fans of the game, experienced roleplayers new to Fighting Fantasy and is ideal for those new to roleplaying.

Onwards to adventure!",7.73913,23
Adventure!,"From Introduction:

In the questionably distant future there exists the Land of Ooo, and it is a place of wonder and mystery populated by goblins, wizards, ogres, candy people, and countless other weird and amazing creatures. It is a world renewed after an unknown cataclysm, a world of magic and heraldry built upon the mysterious ruins of our present. This is the land in which Adventure Time takes place.!

This book was created with the idea of helping players and dungeon masters adapt the 4th Edition of Dungeon and Dragons system to create a quickly progressing game set in the Adventure Time universe. Those unfamiliar with D&amp;D 4E would do well to read the Player's Handbook (D&D 4e) to get a much more in-depth idea of how the game works. This handbook will, however, provide you with much of the information and many of the rule changes needed to start and run a successful game.!

Watching Adventure Time isn't required to play this game, although it will explain some of the lore and will allow player and dungeon master alike to interweave fun and exciting tidbits from the show into their games.!",0,0
Adventure!,"From Introduction:

In the questionably distant future there exists the Land of Ooo, and it is a place of wonder and mystery populated by goblins, wizards, ogres, candy people, and countless other weird and amazing creatures. It is a world renewed after an unknown cataclysm, a world of magic and heraldry built upon the mysterious ruins of our present. This is the land in which Adventure Time takes place.!

This book was created with the idea of helping players and dungeon masters adapt the 4th Edition of Dungeon and Dragons system to create a quickly progressing game set in the Adventure Time universe. Those unfamiliar with D&amp;D 4E would do well to read the Player's Handbook (D&D 4e) to get a much more in-depth idea of how the game works. This handbook will, however, provide you with much of the information and many of the rule changes needed to start and run a successful game.!

Watching Adventure Time isn't required to play this game, although it will explain some of the lore and will allow player and dungeon master alike to interweave fun and exciting tidbits from the show into their games.!",0,0
Adventurers Guild,"From the intro: The City of Rhum is a modular supplement for the Legend Quest game. When used together, these modules will form a detailed city where the adventurers can live and adventure.

User summary: A brief overview of the city of Rhum and details 10 buildings therein.",0,0
Adventures in Fantasy,"From the box:

&quot;ADVENTURES IN FANTASY is the next generation of FANTASY ROLE PLAYING GAMES. YOU are the Knight sent upon a Quest by the King to battle villains and creatures right out of Mythology. From Dwarves to Dragons your wits will be just as useful as your sword. This game comes complete with separate CHARTS, 20-Sided DIE, Sample Adventure and complete rules for starting on the road to high Adventure.&quot;",4.5,2
The Adventures of Indiana Jones Role-Playing Game,"From the Back of the Box:

From Brazil to Bangkok, from the Ark of the Covenant to the Temple of Doom, INDIANA JONES and his companions blaze a trail of adventure and mystery!

Now you can be a part of the action too! Whenever you play the part of Indy or one of his trusted friends.

The boxed set includes an introductory adventure by John Byrne: &quot;The Ikons of Ikammanen&quot;.",5.38333,27
Adventures in Middle-earth,"Publisher blurb:

In Adventures in Middle-earth&trade; the greatest fantasy setting of all time comes to the world's favourite roleplaying game rules! Take your gaming group to Middle-earth with this thematic and atmospheric, OGL-compatible setting guide.

Smaug has been defeated, the Battle of Five Armies has been won, and Bilbo has returned to the Shire. But much danger still remains, and from the Orc-holds of the mountains to the dark and corrupt depths of Mirkwood a darkness waits, recovering its strength, laying its plans, and slowly extending its shadow&hellip;

In Dale, King Bard sends out a call for brave adventurers to journey to Laketown and assist him in restoring the glory of the North.

Adventurers come from all the Free Peoples of Wilderland and beyond, all heeding the call to adventure. Spurred on by diverse callings &ndash; whether it be the lure of the road, the hunger for ancient lore, or the simple urge to defend hearth and kin, adventurers from across Wilderland are preparing to explore Middle-earth and to battle the rising threat of The Shadow wherever it may be found.

The Player's Guide gives you the Middle-earth setting-specific rules and guidance to create your characters and adventure in the world of The Hobbit and The Lord of the Rings using the OGL 5e ruleset.

Character creation features Cultures and Classes designed for Middle-earth to help you get deep into the setting from the very start of your adventures. New rules add excitement to your journeys and encounters, and chart the corruption of the Shadow in the unwary or unwise.

The Quest begins with this lavishly illustrated, hardcover Adventures in Middle-earth Player&rsquo;s Guide, followed by the equally beautiful and useful Adventures in Middle-earth Loremaster&rsquo;s Guide. You can start playing right away with this Player&rsquo;s Guide, and the 5th Edition Dungeons and Dragons&reg; rulebooks from Wizards of the Coast&reg;.

Adventures in Middle-earth: Players Guide contains:

     11 Middle-earth specific playable Cultures
     6 New and unique Classes
     13 New Backgrounds custom-made for Middle-earth
     Middle-earth appropriate arms and armour 
     Unique Journey rules 
     New rules for Corruption 
     New Audience rules 
     Rules for The Fellowship Phase 
     Middle-earth maps (as the end papers) for Players and Loremasters",7.90714,42
After the Bomb,Palladium's post-apocalyptic setting book for TMNT.  Followed by a later edition without the TMNT brand.,6.46667,45
Aftermath!,"&quot; &quot;Aftermath! is a role-playing game created by Paul Hume &amp; Robert Charette which was published in 1981 by Fantasy Games Unlimited.

It is set in a post-apocalyptic world in which the characters typically have to fight for food, water, basic supplies and shelter. The rules are reasonably complex and include a few flow charts and tables to enable the Games Master to simulate the world. This leads to a very immersive gaming experience. However, it does require a good knowledge of the rules to play.

The nature of the Apocalypse is up to the Games Master but it is often reminiscent of the Mad Max films. There is even an expansion (Aftermath! Magic!) to play in a universe dominated by dragons in the style of the film Reign of Fire.&quot;

The system is mostly a dice based system that uses a d20 to resolve combat and skill checks and then uses a table for a 'complex' hit location.  This determines additional effects to the character.  Highly realistic many characters will die after just one hit, so watch out.  Once you get into a firefight someone isn't walking away.

&quot;

Source: Wikipedia, &quot;Aftermath!,&quot; available under the CC-BY-SA License.

This is a boxed set which contains the following:

     Basic Rules book with multiple examples and illustrations of play
     Player's Handbook (Survivors of the Aftermath) detailing construction of characters, equipment and life after the ruin
     Referee's Handbook (The World of Aftermath) detailing construction of the environment and running the game
     Introductory Scenario (Survive!) to allow you to start play easily 
     Playaids",6.80556,36
Afterwars,"Role playing in a Post WWIII America.

From the back cover:

&quot;Out of the radioactive cloud thundered the four horsemen of the apocalypse.  War astride his great red horse.  Followed by Pestilence.  Then rode Conquest upon the technohorse, and finally the skeleton of Death.  These four rode all across the world, shaping its future after the bombs fell.  The war was over.  Now only the fighting was left.

&quot;You are a survivor.  Now it is time for you to start putting it all back together again.  You must beat back scavenger gangs and rads.  Then defeat the mutants and others to explore the universe joints.  It's time for you to start carving out a better world.

&quot;The future depends on you&quot;

Also from the back cover:
- A straightforward combat system
- Detailed character generation system.
- Flexible rules.
- Universe Joints.
- A rich background.
- A detailed listing of weapons, vehicles, and equipment.",8,1
Age of the Tempest,"From publisher blurb:

When evil is afoot, you must join the forest-dwelling rebels and protect justice in the land!

Age of the Tempest - Sword of the High King is a fantasy tabletop roleplaying game aimed for kids and beginners. This is the Player's Handbook, which gently takes you to the world of roleplaying and fantasy, and then shows you how you can be a Witch, a Knight, a Swineherd or a Princess. Or one of the other memorable characters in the world of Nathar, all looking for the Sword of the High King...

To play, you also need the Game Master&#039;s Handbook, character sheets and a map, and a set of dice.",0,0
Age of Ruin,The Age of Ruin game line is a post-apocalyptic role-playing game with a dark and sinister aura.,5,1
Agone,"From the back cover:

AGONE, an epic role-playing game in the Twilight Realms

At the dawn of time, the Muses breathed life and magic into Harmundia.  Then the Masque came, a renegade set on putting all mortals under his yoke.  The Eclipse darkened the sky and Twilight descended upon the world.  Since then, the humans and the nine seasonling races have build the Twilight Realms.  Now the enemies are more deceitful and more powerful than ever.  The Masque has returned, and the evil Darken is creeping into the Realms.  Once again, as the Eminences Grise foretold it, war is setting Harmundia ablaze!

Let the Drama begin!

Born in the wake of Agone of Roundrock, the Inspired have already led full lives and believe their hour of glory has come and gone.  But fate has decided otherwise, for they carry the Flames of the Muses.  As an Eminence Grise, the time has come for you to bring those inspired by the flame - lords, merchants, highwaymen and magicians - together to fight the enemy.

You are the last hope!

Discover a dark and baroque Heroic Fantasy world where weapons clash and spells thunder.  In this setting of intrigues and marvels, be a baron respected by his subjects, a magical minstrel admired by all, an elusive acrobat assassin, or a Machiavellian spy.  Learn to master the four Magical Arts and the Ascendancy, the magic of the Dancers.  Play the part of a brawny ogre, a mysterious black fey, a hunting sprite, a plotting medusa, a wandering spriggan, a sturdy dwarf, a minotaur or an awe-inspiring giant!

Will you be able to protect your flame at all costs?",7.02941,17
Albedo,"&quot;Albedo is a role-playing game based on Steve Gallacci's &quot;Erma Felna: EDF&quot; and &quot;Birthright&quot; storylines, from the funny animal comic anthologies 'Albedo' and 'Critters'.

Written by Craig Hilton and Paul Kidd, it was originally published as a box set in 1988 by Thoughts &amp; Images and consisted of 3 books: Player's Manual, Equipment Description, and Referee's Manual; plus the Tlakatan Scenario (sample scenario) booklet.&quot;

Source: Wikipedia, &quot;Albedo (role-playing game),&quot; available under the CC-BY-SA License.",6.6,5
Alice is Missing,"From the kickstarter:

Alice is Missing, a silent role-playing game about the disappearance of Alice Briarwood, a high school junior in the small town of Silent Falls.
...
The game is played live and without verbal communication. Players inhabit their character for the entirety of the 90-minute play session, and instead of speaking, send text messages back and forth to the other characters in a group chat, as well as individually, as though they aren&rsquo;t in the same place together.

Publisher's blurb:

The game is played live and without verbal communication. Players inhabit their character for the entirety of the 90-minute play session, and instead of speaking, send text messages back and forth to the other characters in a group chat, as well as individually, as though they aren&rsquo;t in the same place together.

Haunting beautiful, deeply personal, and highly innovative Alice is Missing puts a strong focus on the emotional engagement between players, immersing them in a tense, dramatic mystery that unfolds organically through the text messages they send to one another. Right at home with games like Life Is Strange, Gone Home, Oxenfree, and Firewatch, it&rsquo;s designed to feel as much like an event-style experience as it does a role-playing game.",7.63821,280
ALIEN: The Roleplaying Game,"From the back cover:

&ldquo;I can&rsquo;t lie to you about your chances, but &hellip; you have my sympathies.&rdquo;

Space is vast, dark, and not your friend. Gamma rays and neutrino bursts erupt from dying stars to cook you alive, black holes tear you apart, and the void itself boils your blood and seizes your brain. Try to scream and no one can hear you&mdash;hold your breath and you rupture your lungs. Space isn&rsquo;t as empty as you&rsquo;d think, either&mdash;its frontiers are ever expanding. Rival governments wage a cold war of aggression while greedy corporations vie for valuable resources. Colonists reach for the stars and gamble with their lives&mdash;each new world tamed is either feast or famine. And there are things lurking in the shadows of every asteroid&mdash;things strange and different and deadly.

Things alien.

This is the official ALIEN tabletop roleplaying game&mdash;a universe of body horror and corporate brinkmanship, where synthetic people play god while space truckers and marines play host to newborn ghoulish creatures. It&rsquo;s a harsh and unforgiving universe and you are nothing if not expendable.

Stay alive if you can.

This beautifully illustrated, full-color hardcover book presents the world of ALIEN in the year 2183 and provides a fast and effective ruleset designed specifically to enhance the ALIEN experience. The game supports two distinct game modes:

     Cinematic play is based on pre-made scenarios that emulate the dramatic arc of an ALIEN film. Designed to be played in a single session, this game mode emphasizes high stakes and fast and brutal play. You are not all expected to survive. The core rulebook contains one introductory Cinematic scenario, Hope&rsquo;s Last Day.
     Campaign play is designed for longer continuous play with the same cast of player characters over many game sessions, letting you explore the ALIEN universe freely, sandbox style. The core rulebook contains random tables and other powerful tools to quickly create star systems, colonies, missions, encounters, and NPCs for your campaign.


The rules of the game are based on the acclaimed Year Zero Engine, used in award-winning games such as Tales from the Loop, Forbidden Lands and Mutant: Year Zero, but adapted and further developed to fully support the core themes of ALIEN: horror and action in the cold darkness of space.",8.24778,135
Aliens Adventure Game,"From the back of the book:Now you can be a part of the danger and excitement of the hit movie ALIENS, from Twentieth Century Fox! From the ruins of the Colony that was destroyed by the Aliens to the chaos and greed of earth itself, the ALIENS Adventure Game pits you against Aliens, other dangerous lifeforms, and corrupt Humans as you find out what it takes to be a member of the Colonial Marine Corps.

Another Glorious Day in the Corps!

The accent of the game is on the Aliens, of course, but there is far, far more. For those who want to go beyond the Aliens and the Corps, there is a whole galaxy of deceit and danger in the bleak Corporate future of the ALIENS storyline. Try your hand at one of the other possibilities offered: corporate mercenary, explorer, businessman&hellip; your choices are limited only by your imagination.

The ALIENS Adventure Game prominently features full color and black and white art from the movie, as well as fast, fun game mechanics. Fast paced and intense, ALIENS is sure to thrill anyone who enjoyed the movie.

Included are Sections covering:

    Character Generation
    Colonial Marine Background
    Other Character Backgrounds
    General and Professional Skills
    Specialized Skills and Training
    Personal Equipment
    Individual Combat
    Ground, Air, and Spave Vehicles and Combat
    Worlds, Colonies, and Outposts
    Missions and Campaign Settings
    Alien Lifeforms and, of course,
    The ALIENS - Abilities, Metabolism, and Scenario Ideas.",6.48387,31
All Flesh Must Be Eaten,"From the back of the Book


As they approach your home, the evening wind carries their stench through the air.  Your dog barks wildly, frenzied by the smell.  You awaken from a restless sleep, look out your window, and see staggering corpses on the move.

You are halfway down the stairs when you hear footsteps on the porch.  You run into the living room and pry open your gun cabinet.  As you fumble, the front door collapses from the weight of a pair of rotting corpses.

They shamble into the hall, arms outstretched, reaching for you.  You unload your shotgun into them.  They fall back.

To your horror, they rise...

Welcome to the world of Survival Horror

All Flesh must be eaten is a complete roleplaying game.  In it, you will find:


     Eleven different Deadworld settings allowing customization of the storyline.
     A comprehensive zombie creation systems to surprise and alarm your players.
     A list of equipment crucial for surviving a world of shambling horrors.
     Detailed character creation rules for Norms, Survivors, and the Inspired.
     A full exposition of the Unisystem game rules, suitable for any game in any time period.
     Open Gaming License conversion text for porting AFMBE to any modern-day campaign featuring a twenty-sided dice game mechanic.",7.04823,141
