Name,Description,Average Score,Number of Reviews
Rogue Trader,"From the Publishers website:

In Rogue Trader, you take on the role of a Rogue Trader and his most trusted counsellors, empowered by an ancient warrant of trade to seek out profit and plunder amongst unexplored regions of space. Your ship will take you to new worlds and uncharted reaches of the void, where you will encounter rivals, pirates, aliens, and possibly even creatures of the warp. You will acquire and spend great wealth and riches, and fame or infamy will follow. You will discover ancient and forgotten mysteries and search out the unknown to find lost human worlds or never before seen celestial phenomena. You must survive the dangers of space, for beyond the threat of vacuum and deadly radiation lurk things Man was never meant to find.

To be part of a Rogue Trader&rsquo;s crew is to stand on the threshold of nearly unlimited opportunity. Vast profits await for you and your fellow Explorers to find and claim. Fame and fortune reward the bold, but the unwary find only an anonymous death.

&bull; Fast character creation to get you into the game quickly, including a lifetime of possibilities with an expanded origin path system.
&bull; Dynamic rules for all eventualities that let you handle everything from social interaction to deadly fast-paced combat, starships and psychic powers to a system of profit and influence.
&bull; Comprehensive background on Rogue Traders, written by Warhammer 40,000 novelist and GW Design Studio member Andy Hoare.
&bull; Build your own starship or begin play with one of the six pre-generated vessels.

Begin your players&rsquo; path to wealth and glory with a complete starting adventure that puts the Explorers right into the middle of the action. The Rogue Trader core rulebook contains everything you need to start your adventure in the Warhammer 40,000 universe.",7.59135,156
Rolemaster,"4th Edition Core Manual (RMFRP)

From the back cover:

Prepare yourself! You are about to begin your journey toward the ultimate fantasy role playing adventure!  We know you have great stories to tell and fascinating characters to play.  So do your fantasy justice and use the most flexible rules around: Rolemaster Fantasy Role Playing.

Why have your grand tales limited by the rules you use?  Choose the system which tells your story your way.  Rolemaster has been the system of choice for GMs and players for almost 20 years.  They choose Rolemaster because it gives them exactly what they need for their role playing adventures.  You too can now join the enlightened.

Rolemaster Fantasy Role Playing is easier than ever to understand and all you need to play the game - combat, character creation, and spell casting - can be found in the pages of this one book!  Other supplements can be purchased to add as much detail or flavor as you prefer, but all the required rules are here.
Rolemaster is back and better than ever!",6.94828,29
Rosenstrasse,"Publisher's blurb:

Rosenstrasse is a tabletop role-playing scenario exploring the experiences of Jewish-Aryan couples in Berlin between 1933 and 1943, informed by the stories of real people and culminating in the historical Rosenstrasse protest. While the game aims to provide a rich backdrop of Berlin under the rise of the Third Reich, its focus is primarily on the people affected and the evolution of their relationships under duress. As such, the game is intended to be deeply elegiac, to provide an emotionally immersive experience for the players, and to enable a sincere glimpse into the lives of the people who inspired our characters. The experience aims to be tense and difficult for the players to endure.

The narrative focuses on three married couples and a brother-sister pair, all of whom become disenfranchised by the racial laws of Nazi Germany. Each player is assigned both a male and a female character to experience the game, and each character is paired with a spouse or sibling portrayed by another player. The scenario begins with a short set of workshops followed by a series of prologue scenes that establish characters and relationships. Act I and Act II develop the pairs through the growing loss of civil liberties during the rise of the Reich from 1933-1943. These scenes set the emotional groundwork for Act III, which focuses on the arrest of the male characters and the women&rsquo;s participation in the Rosenstrasse protest. A short epilogue brings closure to the characters&rsquo; stories and the game, but leaves them uncertain and still in the context of wartime Germany.",8,1
Rune,"From the back of the box:

RuneQuest is an easy-to-play game of Fantasy Role-Playing.  Participants create imaginary characters to go adventuring through a world of fantasy where magic is real, heroism the accepted norm, and virtue is rewarded!  Characters begin as commoners or young noblemen and work or fight their way through trouble and adversity to reach greatness, collecting gold, magic, and fame along the way.  They can develop as formidable fighters, clever magicians, solemn priests, alchemists, thieves, scholars, or all of them at once!  There is no limit to what a character can do.",7.87667,90
RuneQuest,"From the back of the box:

RuneQuest is an easy-to-play game of Fantasy Role-Playing.  Participants create imaginary characters to go adventuring through a world of fantasy where magic is real, heroism the accepted norm, and virtue is rewarded!  Characters begin as commoners or young noblemen and work or fight their way through trouble and adversity to reach greatness, collecting gold, magic, and fame along the way.  They can develop as formidable fighters, clever magicians, solemn priests, alchemists, thieves, scholars, or all of them at once!  There is no limit to what a character can do.",7.87667,90
RuneSlayers,"&quot; (corrected)
Well after publishing RuneQuest III, Avalon Hill decided to revive the name RuneQuest. Slated for a 1998 release, RuneQuest: Slayers, did not resemble the original RuneQuest in regards to rules or its original setting of Glorantha.

Avalon Hill hired new designers on the project to start over with a fresh approach. This included shelving the original rules system (which Chaosium co-owned) and focusing on a low-magic setting inspired by pulp, sword and sorcery fiction.

Despite the game being finished and &quot;at the printers&quot;, Hasbro, who had recently bought Avalon Hill, decided to shelve the game in mid-1998. RuneQuest: Slayers was destined to never see the light of day.

The rights to RuneQuest: Slayers, however, reverted back to the original creators, J.C. Connors and Christopher Lawrence. It was renamed Runeslayers and put into PDF form on the web for free.

User Contribution:

System is NOT mechanically nor setting related to the classic RuneQuest, though it does share some thematic elements with the newer Mongoose edition of the game, specifically the collection of supernatural runes as part of advancement).

The RPG includes a short solo-module as an introduction, as well as two short adventures, one for each of the game's two settings.

The main &quot;class&quot; players choose from is the WarClan, which decides the character's personality traits and supernatural runic advancement. Players customize their character with a point-based system and can add professions, races, and weapon maneuvers to further differentiate their heroes from each other.

Combat is d6 dice-pool based, non-combat is d10 based, using 2d10 to 4d10 versus attribute or less, with rerolls to represent professional advantages. The group's play style will determine which mechanic (d6 or d10) they use more.

Glyphs are attained by roleplaying according the the WarClan's traditions. Gaining glyphs gives characters access to sets of runes which grants supernatural powers. Other than the runes, Runeslayers is a low-magic setting, with sorcerers and wizards playing the roles of villains rather than heroes.
 &quot;

Source: Wikipedia, &quot;RuneQuest: Slayers/,&quot; available under the CC-BY-SA License.",7.25,4
Rüs,"Also known as R&Uuml;S

From the title page:

&quot;This edition of RUS centres upon life in the Northern reaches of Rus circa 900 AD and the coming of Christianity to that region.&quot;

Contains rules for various character tribes, spells, beasts, and the environment.",4,4
Ryuutama,"User Summary:

Ryuutama is a Japanese RPG with a loosely fantasy western Middle-Age setting and a distinctive tone of positivity and discovery &ndash;&nbsp;though combat is present, it's not the core of the game. The players are travelers in this world, whose details are created collectively, and the game master, in addition to running the game, also has his own character, a dragon-person who can intervene &ndash; usually positively &ndash; in the characters' adventures. The game is aimed to a wide audience, and is rich with aids and advice for the novice players and game masters.",7.78378,37
SAGA System,"From the back cover:

The Wait is Over
After eight years in development Frog God Games finally brings The Slumbering Tsar Saga in its entirety: three books, 14 full adventure modules, more than 80 maps, and hundreds of encounters all compiled into one epic volume.

Travel from the dusty frontier streets of The Camp to the innermost workings of a demonic plot 10,000 years in the making. Witness the bleak expanse of the Desolation, roam the ruined streets and bastions of the Temple-City of Tsar, and plumb the depths of the vast Citadel of Orcus, lost from the knowledge of mankind for hundreds of years. Do the heroes of today dare tread where legends of the past failed?

The Truth Lies Within
The Slumbering Tsar Saga includes the three mega-adventure books: The Desolation, Temple-City of Orcus, and The Hidden Citadel combined into one continuous adventure path taking characters from 7th level all the way to 20th level and above. Each book includes hundreds of different encounters for thousands of hours of play as well as new magic items, monsters, and player handouts. Challenge your players with this adventure of epic proportions, but warn them to bring extra character sheets.

Only true heroes of legend will emerge victorious. Orcus takes the rest.",8.27778,9
Sandman: Map of Halaal,"Description from box back:

&quot;The Sandman. He knows your name. You don't. He knows where you are. You don't. He knows what you have done, and why you must die. You don't.&quot;

&quot;To survive, you must journey through a tempestuous world in search of answers to a question as tenuous as your own existence. You play the role of an amnesiac traveler, lost in a world beyond the natural. The rules are brief, preparation easy, and the story rich. The Sandman is watching... Why don't you face him?&quot;

The player characters awaken on the Orient Express suffering from amnesia - and thus starts this &quot;Instant Adventure&quot;, the first and only offering in what was supposed to be a series of such games.

Sandman is termed an Instant Adventure because it was intended to be played with little or no preparation on the part of the players. The game includes four scenarios (The Sandman Comes, The Prophet of Darkness, A Feast for the Eyes, and Map of Halaal), each of which was intended to be run in a single evening.",7.53333,6
Savage Worlds,"&quot;Savage Worlds is a universal generic, award-winning role-playing game and miniatures wargame. The game emphasizes speed of play and reduced preparation over realism or detail.

The Explorer's Edition is a digest-sized paperback edition of the rules. It features the revisions to melee damage rules first introduced in Deadlands Reloaded, as well as new chase rules. It was released at Origins 2007.&quot;

Source: Wikipedia, &quot;Savage_Worlds,&quot; available under the CC-BY-SA License.",7.6654,302
Scion,"Find your Destiny
The savage Titans have escaped their eternal prison to wage war with the Gods once more.

Their battles in the Overworld have spilled over to ours.

Armed with abilities and weapons granted by their divine parents, the Scions stand as humanity&rsquo;s only defense.

This book includes:

    Six ready-to-play Scions - the offspring of the Gods
    Rules to create your own Scion from one of more than 50 gods from six different pantheons
    The adventure, &quot;The Long Road to Heaven&quot;, using the Storytelling Adventure System",6.93239,71
Second Dawn,"From publisher blurb:

The Earth has been ravaged by viral pathogens, the death of billions observed by the orbital colonies and deep-space habitats that were largely unaffected by the Outbreak. Terrified of infection, nobody came to help. Less than 30 percent survived the first few weeks. Then came the 2nd Wave of infection, spreading steadily outwards from the impact points, and that was when the horror really began...

YELLOW DAWN: This book is crammed with everything you will need to create characters, run scenarios and experience horror and adventure in the fictional world of David J Rodger.

FEATURES: The Influence of Hastur; Medical theories on the Infection; Zombie surges; Comprehensive scavenging system; Computer hacking and drug abuse; Non-human characters; Enhancements through cyberware and bioware; Weaponry, equipment and armour; Complex political, corporate and quasi-religious tensions; Schools of Elemental Magick, occultism, demonology, and the alien horrors of the Outer Chaos &ndash; the Cthulhu Mythos.",0,0
Sengoku,"From the publisher &quot;A roleplaying game set in the 16th century Japan, where honor is more valuable than gold and shame a fate worse than death. Come adventure in the land of 8 million gods.&quot;

A very detailed set of rules and campaign material with a solid reputation.",6.78571,21
The Shab-al-Hiri Roach,"The Shab-al-Hiri Roach is a dark comedy of manners, lampooning academia and asking players to answer a difficult question - are you willing to swallow a soul-eating telepathic insect bent on destroying human civilization?

No?

Even if it will get you tenure?

A fast paced and hilarious game, The Shab-al-Hiri Roach requires no Game Master and can be played in a single evening. If you enjoy crazed one-upmanship, furious stake-setting, and chanting gutteral commands in Sumerian, The Roach would like to have a word with you.",7.00545,55
Shades of Fantasy,"From the back of the book:

&quot;Inside you will find: * 40+ Character Occupations including Exorcists, Witch Hunters, Knights, Holy Knights (5 orders: Knights Inquisitor, the Grey Angels, Knights Imprimatur, Knights of St. Justinian, and Knights Macabre), Sturmguard, Vermitic Warlocks, Militant Wizards, Luminati, and many more! * 15 detailed Fantasy Races including the Fey Folk, Banruks, Gimnar, Nith, Ordrue, and more. Also included are human derivative races like the fey influenced Changelings and the half human, half demonic Devilkin. * 110 Creatures, 100+ Skills and Advantages, 130+ Spells, detailed Religions, a sample History, and Enchanted Items. Flexible rules for Character Creation. Innovative rules for Magik, Combat, Exorcism and Possession. Critical Hit and Fumble Charts, and much more! CONVERTS TO MOST POPULAR ROLEPLAYING GAMES&quot;",9,1
Shadow Lords,"Shadow Lords Tribebook includes:


     The history and culture of the Shadow Lords
     A &quot;Legends of the Garou&quot; comic book
     Five ready-to-play character templates",6,8
Shadow of the Demon Lord,"From publisher blurb:

The End Is Just the Beginning

Sometimes the world needs heroes. But in the desperation of these last days, the world will take all those it can get: heroes, blackguards, madmen, and whoever else is willing to stand against the coming darkness. Will you fight the demons or will you burn it all down and dance among the ashes? Who will you become when the world dies?

Shadow of the Demon Lord opens a door to an imaginary world held in the grip of a cosmic destroyer. Enter a land steeped in the chaos and madness unleashed by the end times, with whole realms overrun by howling herds of beastmen, warped spirits freed from the Underworld, and unspeakable horrors stirred awaken by the Demon Lord&rsquo;s imminent arrival.

A complete tabletop roleplaying game in one book, Shadow of the Demon Lord provides everything you need to create and play characters, form groups in pursuit of adventure, and tell exciting stories with your friends. As well, the book gives Game Masters all the tools they need to create adventures, over one hundred foul creatures, a detailed region of the campaign world, and extensive advice to help run the game.

As the Demon Lord&rsquo;s shadow creeps across the world, it creates the chance for heroes to seize their destinies and villains to accomplish their despicable goals. As you play the game, you and your friends tell stories about thwarting the plots of twisted cultists, hunting down and destroying bizarre demons, exploring lost lands, investigating weird mysteries, and so much more.",8.35217,46
The Shadow of Yesterday,"The Shadow of Yesterday is pulpy sword &amp; sorcery at the end of one world and the beginning of the next. This game melds the best of standard fantasy role playing and a story now narrative engine.

Set in a post apocalyptic fantasy world where the creation of a moon has ravaged cultures and thrown the fate of the earth into question.

The game uses a great mechanic for gaining experience that encourages narrative play. A character may have up to 5 keys and each key details how a character will improve. So if for example, your character had the key of faith, they would gain one XP for defending their faith to others, two XP for converting someone, and five when they defend their faith, even when it brings great harm.",7.71111,45
Shadowdark,"From the introduction:

Shadowdark RPG is a fantasy adventure game where you and your companions delve into buried ruins, lost cities, spider-infested forests, and even fearsome dragon lairs in search of gold and glory.

The Shadowdark is any place where danger and darkness hold sway. It clutches ancient secrets and dusty treasures in its rotting claws, daring fortune seekers to tempt their fates.

With your adventuring companions at your side, you confront the Shadowdark's sinister traps, formidable magics, and ruthless monsters.

If you survive, you'll bring back untold riches plucked from the jaws of death itself. And before long, you'll hear the Shadowdark's call once again!

Shadowdark RPG is rules-light and intuitive. It encourages quick decisions rather than hunting through the rulebook for answers.

In this game, a torch only holds back the pressing darkness for one hour of real-world time. There isn&rsquo;t a moment to waste when the flames are burning low&hellip;",8.39286,28
Shadowrun,"From retailer preview:
Building on the award-winning Shadowrun, Fourth Edition rule set, Fifth Edition introduces the down-and-dirty Sixth World setting, a place where shadowrunners need to count their bullets carefully and be cautious about whom they trust. Running the Matrix has never been easier, as Shadowrun, Fifth Edition features all the tools and resources players need to quickly get into the game and onto the streets, including improved, streamlined Matrix rules, increased gear options, fast character creation, more player aids, expanded gamemaster advice, and pregenerated gear kits. Scheduled to ship in June 2013. PSI CAT27000 ........................$59.99

From the back of the book:
Everything Has A Price
There are cracks in the world. They&rsquo;re slender, dark, and often cold, but they are the only things that keep you hidden. Keep you alive. They are the shadows of the world, and they are where you live.
You are a shadowrunner, thriving in the margins, doing the jobs no one else can. You have no office, no permanent home, no background to check. You are whatever you make yourself. Will you seek justice? Sow seeds of chaos? Sell out to the highest bidder? It&rsquo;s up to you, but this much is certain&mdash;if you do nothing, the streets will eat you alive.
You can survive&mdash;even flourish&mdash;as long as you do what it takes. Sacrifice part of your soul for bleeding-edge gear. Push the limits of your will learning new and dangerous magic. Wire yourself into the Matrix, making your mind one with screaming streams of data. It&rsquo;ll cost you something&mdash;everything does&mdash;but you can make it worth the price.
Shadowrun, Fifth Edition is the newest version of one of the most popular and successful role-playing worlds of all time&mdash;a fusion of man, magic and machine in a dystopian near-future. With rules for character creation, magic, combat, Matrix hacking, rigging, and more, you have everything you need to face the challenges of the Sixth World.",7.4934,106
Shard,"Sourcebook containing Fuzion core rules and some setting information for Shards of the Stone.

From the website:

&quot;When the lesser gods were instructed to create Life, they cast their powers into the creation of the mystical CoreStone. This nexus of all of the powers of each of the gods carried within it the perfect symbiosis of passion and reason, of order and chaos, of reality and unreality. It was unparalleled in its beauty and simplicity but became the source of envy among some of the gods and soon became the centrepoint of a grand struggle of gods versus gods.

Soon, the CoreStone shattered, and with it came the devastation of the Core world in the centre of which the CoreStone was entombed. Shards of the Stone were scattered to the poles of the world and great schisms wracked the landscape as mountains fell and lakes rose from their beds to form the peaks of craggy sentinels of the world's distress.

This is the world into which you are entering. This is the conflict that you will soon become an active participant... or victim of. This is the vision that will become your dream... or your nightmare...

Shards of the Stone features the greatest talent in the gaming and fiction industry including Ed Greenwood, Jason Engle, Matt Forbeck, Dan McGirt, Kevin Ranson, Aaron Acevedo, Jared Nielsen and many more. Shards of the Stone is many realms made into one marvelous setting, each with a distinctly unique and imaginative feel with a ShardMaster moderating the realm and helping each one of you as you contribute to the grand setting.&quot;",6,1
Shatterzone,"From the back of the boxSpace is Big ... Life is Hard ...

You just melted the barrel of your Gurtmann HMG. Your armor's shot full of holes, and you know there are at least five more guns on your tail. The last time you checked, no cavalry was comin' over the hill. And you've still got to fly the shatterzone.

You though you were going to get rich. You thought you were going to get home. Now it looks all you may get is dead.

All in all, a helluva bad day.

The Rule Book. The Universe Guide. The Player's Guide to Shatterzone. The Action Card Deck. Two ten-sided custom dice. The first issue of the Shatterzone newsletter. It's all in this box. It's all you need to play.

And the universe isn't just a game anymore.",6.57143,14
Shock: Social Science Fiction,"Changes from Version 1.1 per the Designer:

The differences are all explanatory, including the outline of play now included in the back of the book. The Antag sheets on the website are also now correct and agree with the book, and the player sheets all have the 3-&gt;8 thing beside them that I hope will help people set their fulcra correctly.",7.3125,8
Silver Age Sentinels,"Core book for the Silver Age Sentinels RPG using the Tri-Stat d10 system.  In addition to the more common black and white printing of this book there is a full color version as well, though this is much harder to find.",6.21739,23
Simian Conquest,"User Summary:

Simian Conquest
Rules for ape fantasy combat and adventure

Play an astronaut trapped on a future Earth, trying to survive in a world of war-like intelligent apes, primitive humans, and dangerous psychic mutants. Or take the role of a fearless ape commander trying to deal with those &quot;pesky humans.&quot;

Rules cover character generation and advancement, character types (such as Astronauts, Intelligent Apes, Primitive Humans, and Mutants), movement, HTH and ranged combat, nets and other special weapons, and horses. Includes a basic campaign setting that discusses encounters, healing, and lost technology. Heavily inspired by the &quot;Planet of the Apes&quot; film series.",7,1
Sine Requie,"From the back of the book:
On June 6, 1944, the world sank in the darkest of hells. On Doomsday the Dead started their hunt against the human specie.
Now it's 1957, the world is a pile of rubble, where the few survivors try to resist to the hunger of the Dead. A few nations, ruled by cruel dictatorship, have survived.
In Germany raised the IV Reich, a reign of horror and madness, of cold genetic experiments aimed to the creation of the chosen race and terrifying weapons.
The great Russia is buried under the titanic Soviet's cities of steel, ruled by the inhuman calculator named Z.A.R. and his bio-machines.
Italy, renamed Sanctum Imperium, is ruled by Pope Leone XIV and his Inquisitors. In those anachronistically lands stakes are returned to burn human flesh.
The darkest future humanity could imagine has become the most hideous of reality. This is the world of Sine Requie.
Face your destiny in this roleplaying horror, crude and realistic.
Explore the world of SINE REQUIE ANNO XIII with an innovative game system based on interpretation, using Minor Arcana and Tarots.
In this book you'll find the setting and all the rules necessary to adventure in the world of SINE REQUIE ANNO XIII.

No piety

No truce

Only blind ferocity",6.14286,7
